{
  "$schema": "https://json-schema.org/draft/2020-12/schema",
  "$id": "https://codecontextbench.dev/schemas/retrieval_events_schema.json",
  "title": "Normalized Retrieval Events",
  "description": "Schema for step-level retrieval events extracted from agent traces. Used by the standalone retrieval evaluation pipeline to compute IR metrics, utilization probes, and downstream impact analyses. Version 1.0.",
  "type": "object",
  "required": [
    "schema_version",
    "generated_at",
    "provenance",
    "coverage",
    "ground_truth",
    "events"
  ],
  "properties": {
    "schema_version": {
      "type": "string",
      "const": "1.0",
      "description": "Schema version for forward-compatibility checks."
    },
    "generated_at": {
      "type": "string",
      "format": "date-time",
      "description": "ISO 8601 timestamp of normalization."
    },
    "provenance": {
      "$ref": "#/$defs/provenance",
      "description": "Run, task, and config identification."
    },
    "coverage": {
      "$ref": "#/$defs/coverage",
      "description": "Flags indicating trace and ground-truth availability."
    },
    "ground_truth": {
      "$ref": "#/$defs/ground_truth",
      "description": "Expected files and optional symbols for this task."
    },
    "events": {
      "type": "array",
      "description": "Ordered list of step-level retrieval events extracted from the agent trace. Empty when coverage.has_trajectory is false (degraded mode).",
      "items": {
        "$ref": "#/$defs/retrieval_event"
      }
    },
    "summary": {
      "$ref": "#/$defs/event_summary",
      "description": "Optional pre-computed summary counts over the events array."
    }
  },
  "additionalProperties": false,
  "$defs": {
    "provenance": {
      "type": "object",
      "required": ["run_id", "task_name", "config_name", "benchmark"],
      "properties": {
        "run_id": {
          "type": "string",
          "description": "Run directory name, e.g. 'fix_haiku_20260223_140913'."
        },
        "batch_timestamp": {
          "type": ["string", "null"],
          "description": "Batch subdirectory timestamp, e.g. '2026-02-23__14-09-21'."
        },
        "task_name": {
          "type": "string",
          "description": "Canonical task identifier, e.g. 'apiserver-doc-001'."
        },
        "trial_name": {
          "type": ["string", "null"],
          "description": "Trial directory name (task_name__hash)."
        },
        "config_name": {
          "type": "string",
          "description": "Config label: 'baseline-local-direct', 'mcp-remote-direct', etc."
        },
        "benchmark": {
          "type": "string",
          "description": "Benchmark suite, e.g. 'ccb_fix' or 'ccb_mcp_crossorg'."
        },
        "model": {
          "type": ["string", "null"],
          "description": "Agent model identifier, e.g. 'claude-haiku-4-5-20251001'."
        }
      },
      "additionalProperties": false
    },
    "coverage": {
      "type": "object",
      "required": [
        "has_trajectory",
        "has_transcript",
        "has_ground_truth",
        "trace_source",
        "degraded_reason"
      ],
      "properties": {
        "has_trajectory": {
          "type": "boolean",
          "description": "True if agent/trajectory.json was available and parseable."
        },
        "has_transcript": {
          "type": "boolean",
          "description": "True if agent/claude-code.txt (JSONL) was available and parseable."
        },
        "has_ground_truth": {
          "type": "boolean",
          "description": "True if file-level ground truth exists for this task."
        },
        "has_chunk_ground_truth": {
          "type": "boolean",
          "default": false,
          "description": "True if chunk/line-level ground truth exists (e.g. defect annotations)."
        },
        "trace_source": {
          "type": ["string", "null"],
          "enum": ["trajectory", "transcript", "merged", null],
          "description": "Which trace source produced the events. 'merged' when both sources were combined. Null in degraded mode."
        },
        "degraded_reason": {
          "type": ["string", "null"],
          "description": "Human-readable explanation when events array is empty or incomplete. Null when fully covered."
        },
        "ground_truth_source": {
          "type": ["string", "null"],
          "description": "Provenance of ground truth, e.g. 'ground_truth_json_files', 'patch', 'test_script'."
        },
        "ground_truth_confidence": {
          "type": ["string", "null"],
          "enum": ["high", "medium", "low", null],
          "description": "Confidence level of ground truth extraction."
        }
      },
      "additionalProperties": false
    },
    "ground_truth": {
      "type": "object",
      "required": ["files"],
      "properties": {
        "files": {
          "type": "array",
          "description": "Repo-relative file paths the agent should have accessed. Empty when coverage.has_ground_truth is false.",
          "items": {
            "type": "string"
          }
        },
        "symbols": {
          "type": "array",
          "description": "Optional expected symbols (function/class names) within ground-truth files.",
          "items": {
            "$ref": "#/$defs/ground_truth_symbol"
          }
        },
        "chunks": {
          "type": "array",
          "description": "Optional line-range annotations within ground-truth files. Present only when coverage.has_chunk_ground_truth is true.",
          "items": {
            "$ref": "#/$defs/ground_truth_chunk"
          }
        }
      },
      "additionalProperties": false
    },
    "ground_truth_symbol": {
      "type": "object",
      "required": ["file", "symbol"],
      "properties": {
        "file": {
          "type": "string",
          "description": "Repo-relative file path containing the symbol."
        },
        "symbol": {
          "type": "string",
          "description": "Symbol name (function, class, variable, etc.)."
        },
        "repo": {
          "type": ["string", "null"],
          "description": "Repository name for cross-repo tasks. Null for single-repo tasks."
        }
      },
      "additionalProperties": false
    },
    "ground_truth_chunk": {
      "type": "object",
      "required": ["file", "line_start", "line_end"],
      "properties": {
        "file": {
          "type": "string",
          "description": "Repo-relative file path."
        },
        "line_start": {
          "type": "integer",
          "minimum": 1,
          "description": "1-based start line of the relevant chunk."
        },
        "line_end": {
          "type": "integer",
          "minimum": 1,
          "description": "1-based end line (inclusive) of the relevant chunk."
        },
        "annotation": {
          "type": ["string", "null"],
          "description": "Optional label (e.g. defect type, relevance category)."
        }
      },
      "additionalProperties": false
    },
    "retrieval_event": {
      "type": "object",
      "required": [
        "step_index",
        "timestamp",
        "tool_name",
        "tool_category",
        "target_files",
        "is_mcp"
      ],
      "properties": {
        "step_index": {
          "type": "integer",
          "minimum": 0,
          "description": "Zero-based ordinal position within the agent trace."
        },
        "timestamp": {
          "type": ["string", "null"],
          "format": "date-time",
          "description": "ISO 8601 timestamp of the tool call. Null if not available in trace."
        },
        "tool_name": {
          "type": "string",
          "description": "Raw tool name from the trace, e.g. 'Read', 'mcp__sourcegraph__sg_read_file', 'Grep'."
        },
        "tool_category": {
          "type": "string",
          "enum": [
            "file_read",
            "file_search",
            "symbol_navigation",
            "code_search",
            "commit_search",
            "deep_search",
            "file_write",
            "other"
          ],
          "description": "Normalized category for cross-config comparison."
        },
        "is_mcp": {
          "type": "boolean",
          "description": "True if the tool call went through an MCP server (Sourcegraph)."
        },
        "arguments": {
          "type": "object",
          "description": "Salient tool arguments (file paths, search patterns, symbol names). Schema varies by tool_category.",
          "additionalProperties": true
        },
        "target_files": {
          "type": "array",
          "description": "Repo-relative file paths accessed or returned by this event. Normalized (no /workspace/ prefix, no diff a/b prefix).",
          "items": {
            "type": "string"
          }
        },
        "target_symbols": {
          "type": "array",
          "description": "Symbols referenced in this event (for symbol_navigation category).",
          "items": {
            "type": "string"
          }
        },
        "hits_ground_truth": {
          "type": "boolean",
          "description": "True if any target_file matches a ground-truth file."
        },
        "matched_ground_truth_files": {
          "type": "array",
          "description": "Subset of ground_truth.files matched by this event's target_files.",
          "items": {
            "type": "string"
          }
        },
        "is_subagent": {
          "type": "boolean",
          "default": false,
          "description": "True if this event originated from a subagent (Task tool) rather than the main agent."
        },
        "cumulative_tokens": {
          "type": ["integer", "null"],
          "description": "Cumulative input+output tokens consumed up to and including this step. Null if not available."
        },
        "elapsed_seconds": {
          "type": ["number", "null"],
          "description": "Seconds elapsed from agent execution start to this step. Null if timestamps unavailable."
        }
      },
      "additionalProperties": false
    },
    "event_summary": {
      "type": "object",
      "properties": {
        "total_events": {
          "type": "integer",
          "description": "Total retrieval events in the events array."
        },
        "mcp_events": {
          "type": "integer",
          "description": "Count of events where is_mcp is true."
        },
        "local_events": {
          "type": "integer",
          "description": "Count of events where is_mcp is false."
        },
        "unique_files_accessed": {
          "type": "integer",
          "description": "Count of distinct files across all target_files."
        },
        "ground_truth_files_hit": {
          "type": "integer",
          "description": "Count of distinct ground-truth files matched by at least one event."
        },
        "ground_truth_files_total": {
          "type": "integer",
          "description": "Total ground-truth files for this task."
        },
        "first_ground_truth_hit_step": {
          "type": ["integer", "null"],
          "description": "Step index of the first event that hits ground truth. Null if no ground truth hit."
        },
        "events_by_category": {
          "type": "object",
          "description": "Event counts keyed by tool_category.",
          "additionalProperties": {
            "type": "integer"
          }
        }
      },
      "additionalProperties": false
    }
  }
}
