{
  "schema_version": "1.0",
  "generated_at": "2026-03-03T00:30:07.416828+00:00",
  "provenance": {
    "run_id": "csb_org_onboarding_haiku_20260228_123206",
    "batch_timestamp": "2026-02-28__12-38-50",
    "task_name": "ccx-onboard-136",
    "trial_name": "ccx-onboard-136__ySVcdJ2",
    "config_name": "baseline-local-direct",
    "benchmark": "unknown",
    "model": "claude-haiku-4-5-20251001"
  },
  "coverage": {
    "has_trajectory": true,
    "has_transcript": true,
    "has_ground_truth": false,
    "has_chunk_ground_truth": false,
    "trace_source": "merged",
    "degraded_reason": null,
    "ground_truth_source": null,
    "ground_truth_confidence": null
  },
  "ground_truth": {
    "files": []
  },
  "events": [
    {
      "step_index": 17,
      "timestamp": "2026-02-28T12:39:47.456Z",
      "tool_name": "Read",
      "tool_category": "file_read",
      "is_mcp": false,
      "arguments": {
        "file_path": "/workspace/android-frameworks-base--d41da232/core/java/android/app/ActivityThread.java"
      },
      "target_files": [
        "android-frameworks-base--d41da232/core/java/android/app/activitythread.java"
      ],
      "target_symbols": [],
      "hits_ground_truth": false,
      "matched_ground_truth_files": [],
      "is_subagent": false,
      "cumulative_tokens": 47990,
      "elapsed_seconds": 20.5
    },
    {
      "step_index": 20,
      "timestamp": "2026-02-28T12:39:59.440Z",
      "tool_name": "Write",
      "tool_category": "file_write",
      "is_mcp": false,
      "arguments": {
        "file_path": "/workspace/answer.json"
      },
      "target_files": [
        "answer.json"
      ],
      "target_symbols": [],
      "hits_ground_truth": false,
      "matched_ground_truth_files": [],
      "is_subagent": false,
      "cumulative_tokens": 52366,
      "elapsed_seconds": 32.4
    }
  ],
  "summary": {
    "total_events": 2,
    "mcp_events": 0,
    "local_events": 2,
    "unique_files_accessed": 2,
    "ground_truth_files_hit": 0,
    "ground_truth_files_total": 0,
    "first_ground_truth_hit_step": null,
    "events_by_category": {
      "file_read": 1,
      "file_write": 1
    }
  }
}
