{
  "schema_version": "1.0",
  "generated_at": "2026-03-03T00:30:02.467108+00:00",
  "provenance": {
    "run_id": "csb_org_domain_haiku_20260302_175821",
    "batch_timestamp": "2026-03-02__18-03-58",
    "task_name": "ccx-domain-153",
    "trial_name": "ccx-domain-153__JEM3bya",
    "config_name": "baseline-local-direct",
    "benchmark": "unknown",
    "model": "claude-haiku-4-5-20251001"
  },
  "coverage": {
    "has_trajectory": true,
    "has_transcript": true,
    "has_ground_truth": false,
    "has_chunk_ground_truth": false,
    "trace_source": "merged",
    "degraded_reason": null,
    "ground_truth_source": null,
    "ground_truth_confidence": null
  },
  "ground_truth": {
    "files": []
  },
  "events": [
    {
      "step_index": 13,
      "timestamp": "2026-03-02T18:04:42.291Z",
      "tool_name": "Read",
      "tool_category": "file_read",
      "is_mcp": false,
      "arguments": {
        "file_path": "/workspace/envoy--v1.31.2/source/common/router/config_impl.h"
      },
      "target_files": [
        "envoy--v1.31.2/source/common/router/config_impl.h"
      ],
      "target_symbols": [],
      "hits_ground_truth": false,
      "matched_ground_truth_files": [],
      "is_subagent": false,
      "cumulative_tokens": 57514,
      "elapsed_seconds": 23.9
    },
    {
      "step_index": 16,
      "timestamp": "2026-03-02T18:04:50.021Z",
      "tool_name": "Read",
      "tool_category": "file_read",
      "is_mcp": false,
      "arguments": {
        "file_path": "/workspace/envoy--v1.31.2/source/common/http/conn_manager_impl.h"
      },
      "target_files": [
        "envoy--v1.31.2/source/common/http/conn_manager_impl.h"
      ],
      "target_symbols": [],
      "hits_ground_truth": false,
      "matched_ground_truth_files": [],
      "is_subagent": false,
      "cumulative_tokens": 62905,
      "elapsed_seconds": 31.6
    },
    {
      "step_index": 17,
      "timestamp": "2026-03-02T18:04:51.604Z",
      "tool_name": "Read",
      "tool_category": "file_read",
      "is_mcp": false,
      "arguments": {
        "file_path": "/workspace/envoy--v1.31.2/source/common/router/router.h"
      },
      "target_files": [
        "envoy--v1.31.2/source/common/router/router.h"
      ],
      "target_symbols": [],
      "hits_ground_truth": false,
      "matched_ground_truth_files": [],
      "is_subagent": false,
      "cumulative_tokens": 63598,
      "elapsed_seconds": 33.2
    },
    {
      "step_index": 41,
      "timestamp": "2026-03-02T18:06:04.989Z",
      "tool_name": "Write",
      "tool_category": "file_write",
      "is_mcp": false,
      "arguments": {
        "file_path": "/workspace/answer.json"
      },
      "target_files": [
        "answer.json"
      ],
      "target_symbols": [],
      "hits_ground_truth": false,
      "matched_ground_truth_files": [],
      "is_subagent": false,
      "cumulative_tokens": 103077,
      "elapsed_seconds": 106.6
    }
  ],
  "summary": {
    "total_events": 4,
    "mcp_events": 0,
    "local_events": 4,
    "unique_files_accessed": 4,
    "ground_truth_files_hit": 0,
    "ground_truth_files_total": 0,
    "first_ground_truth_hit_step": null,
    "events_by_category": {
      "file_read": 3,
      "file_write": 1
    }
  }
}
