{
  "schema_version": "1.0",
  "generated_at": "2026-03-03T00:30:37.739180+00:00",
  "provenance": {
    "run_id": "understand_haiku_20260301_031852",
    "batch_timestamp": "",
    "task_name": "kafka-build-orient-001",
    "trial_name": "kafka-build-orient-001__vTm77Fd",
    "config_name": "baseline-local-direct",
    "benchmark": "ccb_understand",
    "model": "claude-haiku-4-5-20251001"
  },
  "coverage": {
    "has_trajectory": true,
    "has_transcript": true,
    "has_ground_truth": true,
    "has_chunk_ground_truth": false,
    "trace_source": "merged",
    "degraded_reason": null,
    "ground_truth_source": "ground_truth_json_refs",
    "ground_truth_confidence": "medium"
  },
  "ground_truth": {
    "files": [
      "bin/kafka-server-start",
      "kafka/server/KafkaApis",
      "core/src/main/scala/kafka/server/KafkaConfig"
    ]
  },
  "events": [
    {
      "step_index": 0,
      "timestamp": "2026-03-01T03:35:57.441Z",
      "tool_name": "Read",
      "tool_category": "file_read",
      "is_mcp": false,
      "arguments": {
        "file_path": "/logs/agent/sessions/projects/-workspace/memory/MEMORY.md"
      },
      "target_files": [
        "logs/agent/sessions/projects/-workspace/memory/memory.md"
      ],
      "target_symbols": [],
      "hits_ground_truth": false,
      "matched_ground_truth_files": [],
      "is_subagent": false,
      "cumulative_tokens": 32378,
      "elapsed_seconds": 2.2
    },
    {
      "step_index": 1,
      "timestamp": "2026-03-01T03:35:59.639Z",
      "tool_name": "Read",
      "tool_category": "file_read",
      "is_mcp": false,
      "arguments": {
        "file_path": "/workspace"
      },
      "target_files": [],
      "target_symbols": [],
      "hits_ground_truth": false,
      "matched_ground_truth_files": [],
      "is_subagent": false,
      "cumulative_tokens": 42688,
      "elapsed_seconds": 4.3
    }
  ],
  "summary": {
    "total_events": 2,
    "mcp_events": 0,
    "local_events": 2,
    "unique_files_accessed": 1,
    "ground_truth_files_hit": 0,
    "ground_truth_files_total": 3,
    "first_ground_truth_hit_step": null,
    "events_by_category": {
      "file_read": 2
    }
  }
}
