{
  "schema_version": "1.0",
  "generated_at": "2026-02-26T21:52:03.631718+00:00",
  "provenance": {
    "run_id": "understand_haiku_20260225_211346",
    "batch_timestamp": "",
    "task_name": "kafka-build-orient-001",
    "trial_name": "kafka-build-orient-001__gwGA3RR",
    "config_name": "baseline-local-direct",
    "benchmark": "ccb_understand",
    "model": "claude-haiku-4-5-20251001"
  },
  "coverage": {
    "has_trajectory": true,
    "has_transcript": true,
    "has_ground_truth": true,
    "has_chunk_ground_truth": false,
    "trace_source": "merged",
    "degraded_reason": null,
    "ground_truth_source": "ground_truth_json_refs",
    "ground_truth_confidence": "medium"
  },
  "ground_truth": {
    "files": [
      "bin/kafka-server-start",
      "kafka/server/KafkaApis",
      "core/src/main/scala/kafka/server/KafkaConfig"
    ]
  },
  "events": [
    {
      "step_index": 0,
      "timestamp": "2026-02-25T22:45:28.800Z",
      "tool_name": "Read",
      "tool_category": "file_read",
      "is_mcp": false,
      "arguments": {
        "file_path": "/workspace"
      },
      "target_files": [],
      "target_symbols": [],
      "hits_ground_truth": false,
      "matched_ground_truth_files": [],
      "is_subagent": false,
      "cumulative_tokens": 32120,
      "elapsed_seconds": 3.2
    },
    {
      "step_index": 4,
      "timestamp": "2026-02-25T22:46:52.387Z",
      "tool_name": "Read",
      "tool_category": "file_read",
      "is_mcp": false,
      "arguments": {
        "file_path": "/workspace/core/src/main/scala/kafka/server/KafkaConfig.scala"
      },
      "target_files": [
        "core/src/main/scala/kafka/server/kafkaconfig.scala"
      ],
      "target_symbols": [],
      "hits_ground_truth": false,
      "matched_ground_truth_files": [],
      "is_subagent": false,
      "cumulative_tokens": 44900,
      "elapsed_seconds": 86.8
    },
    {
      "step_index": 5,
      "timestamp": "2026-02-25T22:46:52.736Z",
      "tool_name": "Read",
      "tool_category": "file_read",
      "is_mcp": false,
      "arguments": {
        "file_path": "/workspace/core/src/main/scala/kafka/server/DynamicBrokerConfig.scala"
      },
      "target_files": [
        "core/src/main/scala/kafka/server/dynamicbrokerconfig.scala"
      ],
      "target_symbols": [],
      "hits_ground_truth": false,
      "matched_ground_truth_files": [],
      "is_subagent": false,
      "cumulative_tokens": 44900,
      "elapsed_seconds": 87.2
    },
    {
      "step_index": 6,
      "timestamp": "2026-02-25T22:46:53.027Z",
      "tool_name": "Glob",
      "tool_category": "file_search",
      "is_mcp": false,
      "arguments": {
        "pattern": "**/ServerConfigs.java"
      },
      "target_files": [],
      "target_symbols": [],
      "hits_ground_truth": false,
      "matched_ground_truth_files": [],
      "is_subagent": false,
      "cumulative_tokens": 44900,
      "elapsed_seconds": 87.4
    },
    {
      "step_index": 7,
      "timestamp": "2026-02-25T22:46:54.714Z",
      "tool_name": "Read",
      "tool_category": "file_read",
      "is_mcp": false,
      "arguments": {
        "file_path": "/workspace/server/src/main/java/org/apache/kafka/server/config/ServerConfigs.java"
      },
      "target_files": [
        "server/src/main/java/org/apache/kafka/server/config/serverconfigs.java",
        "settings.gradle"
      ],
      "target_symbols": [],
      "hits_ground_truth": false,
      "matched_ground_truth_files": [],
      "is_subagent": false,
      "cumulative_tokens": 54323,
      "elapsed_seconds": 89.1
    },
    {
      "step_index": 8,
      "timestamp": "2026-02-25T22:46:55.564Z",
      "tool_name": "Grep",
      "tool_category": "code_search",
      "is_mcp": false,
      "arguments": {
        "pattern": "dynamicConfigUpdateModes|DYNAMIC_UPDATE_MODE",
        "path": "/workspace/core/src/main/scala/kafka/server",
        "type": "java"
      },
      "target_files": [
        "build.gradle"
      ],
      "target_symbols": [],
      "hits_ground_truth": false,
      "matched_ground_truth_files": [],
      "is_subagent": false,
      "cumulative_tokens": 54323,
      "elapsed_seconds": 90.0
    },
    {
      "step_index": 9,
      "timestamp": "2026-02-25T22:46:57.165Z",
      "tool_name": "Read",
      "tool_category": "file_read",
      "is_mcp": false,
      "arguments": {
        "file_path": "/workspace/core/src/main/scala/kafka/server/DynamicBrokerConfig.scala"
      },
      "target_files": [
        "core/src/main/scala/kafka/server/dynamicbrokerconfig.scala"
      ],
      "target_symbols": [],
      "hits_ground_truth": false,
      "matched_ground_truth_files": [],
      "is_subagent": false,
      "cumulative_tokens": 61255,
      "elapsed_seconds": 91.6
    },
    {
      "step_index": 10,
      "timestamp": "2026-02-25T22:46:57.459Z",
      "tool_name": "Glob",
      "tool_category": "file_search",
      "is_mcp": false,
      "arguments": {
        "pattern": "**/*TopicCreationTest*.scala"
      },
      "target_files": [],
      "target_symbols": [],
      "hits_ground_truth": false,
      "matched_ground_truth_files": [],
      "is_subagent": false,
      "cumulative_tokens": 61255,
      "elapsed_seconds": 91.9
    },
    {
      "step_index": 11,
      "timestamp": "2026-02-25T22:46:59.213Z",
      "tool_name": "Read",
      "tool_category": "file_read",
      "is_mcp": false,
      "arguments": {
        "file_path": "/workspace/core/src/test/scala/unit/kafka/server/ControllerApisTest.scala"
      },
      "target_files": [
        "core/src/test/scala/unit/kafka/server/controllerapistest.scala"
      ],
      "target_symbols": [],
      "hits_ground_truth": false,
      "matched_ground_truth_files": [],
      "is_subagent": false,
      "cumulative_tokens": 70053,
      "elapsed_seconds": 93.6
    },
    {
      "step_index": 13,
      "timestamp": "2026-02-25T22:47:01.964Z",
      "tool_name": "Read",
      "tool_category": "file_read",
      "is_mcp": false,
      "arguments": {
        "file_path": "/workspace/server/src/main/java/org/apache/kafka/server/config/AbstractKafkaConfig.java"
      },
      "target_files": [
        "server/src/main/java/org/apache/kafka/server/config/abstractkafkaconfig.java"
      ],
      "target_symbols": [],
      "hits_ground_truth": false,
      "matched_ground_truth_files": [],
      "is_subagent": false,
      "cumulative_tokens": 76930,
      "elapsed_seconds": 96.4
    },
    {
      "step_index": 17,
      "timestamp": "2026-02-25T22:52:09.248Z",
      "tool_name": "Read",
      "tool_category": "file_read",
      "is_mcp": false,
      "arguments": {
        "file_path": "/workspace/storage/src/main/java/org/apache/kafka/storage/internals/log/LogConfig.java"
      },
      "target_files": [
        "storage/src/main/java/org/apache/kafka/storage/internals/log/logconfig.java"
      ],
      "target_symbols": [],
      "hits_ground_truth": false,
      "matched_ground_truth_files": [],
      "is_subagent": false,
      "cumulative_tokens": 85029,
      "elapsed_seconds": 403.7
    },
    {
      "step_index": 18,
      "timestamp": "2026-02-25T22:53:43.084Z",
      "tool_name": "Write",
      "tool_category": "file_write",
      "is_mcp": false,
      "arguments": {
        "file_path": "/logs/agent/onboarding.md"
      },
      "target_files": [
        "logs/agent/onboarding.md"
      ],
      "target_symbols": [],
      "hits_ground_truth": false,
      "matched_ground_truth_files": [],
      "is_subagent": false,
      "cumulative_tokens": 85569,
      "elapsed_seconds": 497.5
    },
    {
      "step_index": 19,
      "timestamp": "2026-02-25T22:53:46.728Z",
      "tool_name": "Read",
      "tool_category": "file_read",
      "is_mcp": false,
      "arguments": {
        "file_path": "/logs/agent/onboarding.md"
      },
      "target_files": [
        "logs/agent/onboarding.md"
      ],
      "target_symbols": [],
      "hits_ground_truth": false,
      "matched_ground_truth_files": [],
      "is_subagent": false,
      "cumulative_tokens": 90881,
      "elapsed_seconds": 501.1
    }
  ],
  "summary": {
    "total_events": 13,
    "mcp_events": 0,
    "local_events": 13,
    "unique_files_accessed": 9,
    "ground_truth_files_hit": 0,
    "ground_truth_files_total": 3,
    "first_ground_truth_hit_step": null,
    "events_by_category": {
      "file_read": 9,
      "file_search": 2,
      "code_search": 1,
      "file_write": 1
    }
  }
}
