{
  "schema_version": "1.0",
  "generated_at": "2026-03-03T00:30:00.270642+00:00",
  "provenance": {
    "run_id": "csb_org_crossrepo_tracing_haiku_20260228_025547",
    "batch_timestamp": "2026-02-28__04-20-52",
    "task_name": "ccx-dep-trace-133",
    "trial_name": "ccx-dep-trace-133__GLPNW4g",
    "config_name": "baseline-local-direct",
    "benchmark": "unknown",
    "model": "claude-haiku-4-5-20251001"
  },
  "coverage": {
    "has_trajectory": true,
    "has_transcript": true,
    "has_ground_truth": false,
    "has_chunk_ground_truth": false,
    "trace_source": "merged",
    "degraded_reason": null,
    "ground_truth_source": null,
    "ground_truth_confidence": null
  },
  "ground_truth": {
    "files": []
  },
  "events": [
    {
      "step_index": 3,
      "timestamp": "2026-02-28T04:31:45.333Z",
      "tool_name": "Glob",
      "tool_category": "file_search",
      "is_mcp": false,
      "arguments": {
        "pattern": "third_party/blink/renderer/core/css/resolver/**/*.h",
        "path": "/workspace/chromium--2d05e315"
      },
      "target_files": [],
      "target_symbols": [],
      "hits_ground_truth": false,
      "matched_ground_truth_files": [],
      "is_subagent": false,
      "cumulative_tokens": 43439,
      "elapsed_seconds": 6.0
    },
    {
      "step_index": 4,
      "timestamp": "2026-02-28T04:31:45.649Z",
      "tool_name": "Glob",
      "tool_category": "file_search",
      "is_mcp": false,
      "arguments": {
        "pattern": "third_party/blink/renderer/core/layout/*.h",
        "path": "/workspace/chromium--2d05e315"
      },
      "target_files": [],
      "target_symbols": [],
      "hits_ground_truth": false,
      "matched_ground_truth_files": [],
      "is_subagent": false,
      "cumulative_tokens": 43439,
      "elapsed_seconds": 6.3
    },
    {
      "step_index": 5,
      "timestamp": "2026-02-28T04:31:45.901Z",
      "tool_name": "Glob",
      "tool_category": "file_search",
      "is_mcp": false,
      "arguments": {
        "pattern": "third_party/blink/renderer/core/paint/*.h",
        "path": "/workspace/chromium--2d05e315"
      },
      "target_files": [],
      "target_symbols": [],
      "hits_ground_truth": false,
      "matched_ground_truth_files": [],
      "is_subagent": false,
      "cumulative_tokens": 43721,
      "elapsed_seconds": 6.6
    },
    {
      "step_index": 18,
      "timestamp": "2026-02-28T04:32:07.067Z",
      "tool_name": "Read",
      "tool_category": "file_read",
      "is_mcp": false,
      "arguments": {
        "file_path": "/workspace/chromium--2d05e315/third_party/blink/renderer/core/layout/layout_object.h"
      },
      "target_files": [
        "chromium--2d05e315/third_party/blink/renderer/core/layout/layout_object.h",
        "chromium--2d05e315/third_party/blink/renderer/core/css/resolver/style_resolver.h"
      ],
      "target_symbols": [],
      "hits_ground_truth": false,
      "matched_ground_truth_files": [],
      "is_subagent": false,
      "cumulative_tokens": 61970,
      "elapsed_seconds": 27.7
    },
    {
      "step_index": 19,
      "timestamp": "2026-02-28T04:32:06.751Z",
      "tool_name": "Read",
      "tool_category": "file_read",
      "is_mcp": false,
      "arguments": {
        "file_path": "/workspace/chromium--2d05e315/third_party/blink/renderer/core/css/resolver/style_resolver.h"
      },
      "target_files": [
        "chromium--2d05e315/third_party/blink/renderer/core/css/resolver/style_resolver.h",
        "chromium--2d05e315/third_party/blink/renderer/core/layout/layout_object.h"
      ],
      "target_symbols": [],
      "hits_ground_truth": false,
      "matched_ground_truth_files": [],
      "is_subagent": false,
      "cumulative_tokens": 61970,
      "elapsed_seconds": 27.4
    },
    {
      "step_index": 20,
      "timestamp": "2026-02-28T04:32:07.338Z",
      "tool_name": "Read",
      "tool_category": "file_read",
      "is_mcp": false,
      "arguments": {
        "file_path": "/workspace/chromium--2d05e315/third_party/blink/renderer/core/paint/paint_layer.h"
      },
      "target_files": [
        "chromium--2d05e315/third_party/blink/renderer/core/paint/paint_layer.h"
      ],
      "target_symbols": [],
      "hits_ground_truth": false,
      "matched_ground_truth_files": [],
      "is_subagent": false,
      "cumulative_tokens": 61970,
      "elapsed_seconds": 28.0
    },
    {
      "step_index": 21,
      "timestamp": "2026-02-28T04:32:07.627Z",
      "tool_name": "Read",
      "tool_category": "file_read",
      "is_mcp": false,
      "arguments": {
        "file_path": "/workspace/chromium--2d05e315/third_party/blink/renderer/platform/graphics/paint/paint_controller.h"
      },
      "target_files": [
        "chromium--2d05e315/third_party/blink/renderer/platform/graphics/paint/paint_controller.h"
      ],
      "target_symbols": [],
      "hits_ground_truth": false,
      "matched_ground_truth_files": [],
      "is_subagent": false,
      "cumulative_tokens": 62340,
      "elapsed_seconds": 28.3
    },
    {
      "step_index": 30,
      "timestamp": "2026-02-28T04:32:15.883Z",
      "tool_name": "Read",
      "tool_category": "file_read",
      "is_mcp": false,
      "arguments": {
        "file_path": "/workspace/chromium--2d05e315/third_party/blink/renderer/core/paint/paint_layer.h"
      },
      "target_files": [
        "chromium--2d05e315/third_party/blink/renderer/core/paint/paint_layer.h",
        "chromium--2d05e315/third_party/blink/renderer/core/css/resolver/style_resolver.h"
      ],
      "target_symbols": [],
      "hits_ground_truth": false,
      "matched_ground_truth_files": [],
      "is_subagent": false,
      "cumulative_tokens": 72717,
      "elapsed_seconds": 36.5
    },
    {
      "step_index": 31,
      "timestamp": "2026-02-28T04:32:15.199Z",
      "tool_name": "Read",
      "tool_category": "file_read",
      "is_mcp": false,
      "arguments": {
        "file_path": "/workspace/chromium--2d05e315/third_party/blink/renderer/core/css/resolver/style_resolver.h"
      },
      "target_files": [
        "chromium--2d05e315/third_party/blink/renderer/core/css/resolver/style_resolver.h",
        "chromium--2d05e315/third_party/blink/renderer/core/layout/layout_object.h"
      ],
      "target_symbols": [],
      "hits_ground_truth": false,
      "matched_ground_truth_files": [],
      "is_subagent": false,
      "cumulative_tokens": 72717,
      "elapsed_seconds": 35.8
    },
    {
      "step_index": 32,
      "timestamp": "2026-02-28T04:32:16.199Z",
      "tool_name": "Read",
      "tool_category": "file_read",
      "is_mcp": false,
      "arguments": {
        "file_path": "/workspace/chromium--2d05e315/third_party/blink/renderer/platform/graphics/paint/paint_controller.h"
      },
      "target_files": [
        "chromium--2d05e315/third_party/blink/renderer/platform/graphics/paint/paint_controller.h",
        "chromium--2d05e315/third_party/blink/renderer/core/paint/paint_layer.h"
      ],
      "target_symbols": [],
      "hits_ground_truth": false,
      "matched_ground_truth_files": [],
      "is_subagent": false,
      "cumulative_tokens": 73170,
      "elapsed_seconds": 36.8
    },
    {
      "step_index": 33,
      "timestamp": "2026-02-28T04:32:15.545Z",
      "tool_name": "Read",
      "tool_category": "file_read",
      "is_mcp": false,
      "arguments": {
        "file_path": "/workspace/chromium--2d05e315/third_party/blink/renderer/core/layout/layout_object.h"
      },
      "target_files": [
        "chromium--2d05e315/third_party/blink/renderer/core/layout/layout_object.h",
        "chromium--2d05e315/third_party/blink/renderer/platform/graphics/paint/paint_controller.h"
      ],
      "target_symbols": [],
      "hits_ground_truth": false,
      "matched_ground_truth_files": [],
      "is_subagent": false,
      "cumulative_tokens": 72717,
      "elapsed_seconds": 36.2
    },
    {
      "step_index": 39,
      "timestamp": "2026-02-28T04:32:24.249Z",
      "tool_name": "Read",
      "tool_category": "file_read",
      "is_mcp": false,
      "arguments": {
        "file_path": "/workspace/chromium--2d05e315/third_party/blink/renderer/platform/graphics/paint/display_item_list.h"
      },
      "target_files": [
        "chromium--2d05e315/third_party/blink/renderer/platform/graphics/paint/display_item_list.h"
      ],
      "target_symbols": [],
      "hits_ground_truth": false,
      "matched_ground_truth_files": [],
      "is_subagent": false,
      "cumulative_tokens": 81329,
      "elapsed_seconds": 44.9
    },
    {
      "step_index": 41,
      "timestamp": "2026-02-28T04:32:32.964Z",
      "tool_name": "Write",
      "tool_category": "file_write",
      "is_mcp": false,
      "arguments": {
        "file_path": "/workspace/answer.json"
      },
      "target_files": [
        "answer.json"
      ],
      "target_symbols": [],
      "hits_ground_truth": false,
      "matched_ground_truth_files": [],
      "is_subagent": false,
      "cumulative_tokens": 83555,
      "elapsed_seconds": 53.6
    },
    {
      "step_index": 42,
      "timestamp": "2026-02-28T04:32:35.389Z",
      "tool_name": "Read",
      "tool_category": "file_read",
      "is_mcp": false,
      "arguments": {
        "file_path": "/workspace/answer.json"
      },
      "target_files": [
        "answer.json"
      ],
      "target_symbols": [],
      "hits_ground_truth": false,
      "matched_ground_truth_files": [],
      "is_subagent": false,
      "cumulative_tokens": 82472,
      "elapsed_seconds": 56.0
    }
  ],
  "summary": {
    "total_events": 14,
    "mcp_events": 0,
    "local_events": 14,
    "unique_files_accessed": 6,
    "ground_truth_files_hit": 0,
    "ground_truth_files_total": 0,
    "first_ground_truth_hit_step": null,
    "events_by_category": {
      "file_search": 3,
      "file_read": 10,
      "file_write": 1
    }
  }
}
