{
  "schema_version": "1.0",
  "generated_at": "2026-03-03T00:30:09.554768+00:00",
  "provenance": {
    "run_id": "csb_org_platform_haiku_20260301_185444",
    "batch_timestamp": "2026-03-01__19-02-41",
    "task_name": "ccx-platform-244",
    "trial_name": "ccx-platform-244__b7DuCEs",
    "config_name": "baseline-local-direct",
    "benchmark": "unknown",
    "model": "claude-haiku-4-5-20251001"
  },
  "coverage": {
    "has_trajectory": true,
    "has_transcript": true,
    "has_ground_truth": false,
    "has_chunk_ground_truth": false,
    "trace_source": "merged",
    "degraded_reason": null,
    "ground_truth_source": null,
    "ground_truth_confidence": null
  },
  "ground_truth": {
    "files": []
  },
  "events": [
    {
      "step_index": 6,
      "timestamp": "2026-03-01T19:03:14.020Z",
      "tool_name": "Read",
      "tool_category": "file_read",
      "is_mcp": false,
      "arguments": {
        "file_path": "/workspace/envoy--v1.31.2/envoy/server/hot_restart.h"
      },
      "target_files": [
        "envoy--v1.31.2/envoy/server/hot_restart.h"
      ],
      "target_symbols": [],
      "hits_ground_truth": false,
      "matched_ground_truth_files": [],
      "is_subagent": false,
      "cumulative_tokens": 46674,
      "elapsed_seconds": 13.3
    },
    {
      "step_index": 7,
      "timestamp": "2026-03-01T19:03:14.255Z",
      "tool_name": "Read",
      "tool_category": "file_read",
      "is_mcp": false,
      "arguments": {
        "file_path": "/workspace/envoy--v1.31.2/source/server/hot_restart_impl.h"
      },
      "target_files": [
        "envoy--v1.31.2/source/server/hot_restart_impl.h"
      ],
      "target_symbols": [],
      "hits_ground_truth": false,
      "matched_ground_truth_files": [],
      "is_subagent": false,
      "cumulative_tokens": 46674,
      "elapsed_seconds": 13.6
    },
    {
      "step_index": 8,
      "timestamp": "2026-03-01T19:03:14.469Z",
      "tool_name": "Read",
      "tool_category": "file_read",
      "is_mcp": false,
      "arguments": {
        "file_path": "/workspace/envoy--v1.31.2/source/server/hot_restarting_base.h"
      },
      "target_files": [
        "envoy--v1.31.2/source/server/hot_restarting_base.h"
      ],
      "target_symbols": [],
      "hits_ground_truth": false,
      "matched_ground_truth_files": [],
      "is_subagent": false,
      "cumulative_tokens": 46910,
      "elapsed_seconds": 13.8
    },
    {
      "step_index": 9,
      "timestamp": "2026-03-01T19:03:16.272Z",
      "tool_name": "Read",
      "tool_category": "file_read",
      "is_mcp": false,
      "arguments": {
        "file_path": "/workspace/envoy--v1.31.2/source/server/hot_restarting_child.h"
      },
      "target_files": [
        "envoy--v1.31.2/source/server/hot_restarting_child.h"
      ],
      "target_symbols": [],
      "hits_ground_truth": false,
      "matched_ground_truth_files": [],
      "is_subagent": false,
      "cumulative_tokens": 48562,
      "elapsed_seconds": 15.6
    },
    {
      "step_index": 10,
      "timestamp": "2026-03-01T19:03:16.567Z",
      "tool_name": "Read",
      "tool_category": "file_read",
      "is_mcp": false,
      "arguments": {
        "file_path": "/workspace/envoy--v1.31.2/source/server/hot_restarting_parent.h"
      },
      "target_files": [
        "envoy--v1.31.2/source/server/hot_restarting_parent.h"
      ],
      "target_symbols": [],
      "hits_ground_truth": false,
      "matched_ground_truth_files": [],
      "is_subagent": false,
      "cumulative_tokens": 48742,
      "elapsed_seconds": 15.9
    },
    {
      "step_index": 11,
      "timestamp": "2026-03-01T19:03:18.419Z",
      "tool_name": "Read",
      "tool_category": "file_read",
      "is_mcp": false,
      "arguments": {
        "file_path": "/workspace/envoy--v1.31.2/envoy/api/os_sys_calls_hot_restart.h"
      },
      "target_files": [
        "envoy--v1.31.2/envoy/api/os_sys_calls_hot_restart.h"
      ],
      "target_symbols": [],
      "hits_ground_truth": false,
      "matched_ground_truth_files": [],
      "is_subagent": false,
      "cumulative_tokens": 63076,
      "elapsed_seconds": 17.7
    },
    {
      "step_index": 13,
      "timestamp": "2026-03-01T19:03:20.646Z",
      "tool_name": "Read",
      "tool_category": "file_read",
      "is_mcp": false,
      "arguments": {
        "file_path": "/workspace/envoy--v1.31.2/source/server/hot_restart.proto"
      },
      "target_files": [
        "envoy--v1.31.2/source/server/hot_restart.proto"
      ],
      "target_symbols": [],
      "hits_ground_truth": false,
      "matched_ground_truth_files": [],
      "is_subagent": false,
      "cumulative_tokens": 68768,
      "elapsed_seconds": 20.0
    },
    {
      "step_index": 16,
      "timestamp": "2026-03-01T19:03:26.051Z",
      "tool_name": "Read",
      "tool_category": "file_read",
      "is_mcp": false,
      "arguments": {
        "file_path": "/workspace/envoy--v1.31.2/source/server/hot_restart_impl.cc"
      },
      "target_files": [
        "envoy--v1.31.2/source/server/hot_restart_impl.cc"
      ],
      "target_symbols": [],
      "hits_ground_truth": false,
      "matched_ground_truth_files": [],
      "is_subagent": false,
      "cumulative_tokens": 74373,
      "elapsed_seconds": 25.4
    },
    {
      "step_index": 17,
      "timestamp": "2026-03-01T19:03:26.749Z",
      "tool_name": "Read",
      "tool_category": "file_read",
      "is_mcp": false,
      "arguments": {
        "file_path": "/workspace/envoy--v1.31.2/source/server/hot_restarting_base.cc"
      },
      "target_files": [
        "envoy--v1.31.2/source/server/hot_restarting_base.cc"
      ],
      "target_symbols": [],
      "hits_ground_truth": false,
      "matched_ground_truth_files": [],
      "is_subagent": false,
      "cumulative_tokens": 74563,
      "elapsed_seconds": 26.1
    },
    {
      "step_index": 18,
      "timestamp": "2026-03-01T19:03:28.873Z",
      "tool_name": "Read",
      "tool_category": "file_read",
      "is_mcp": false,
      "arguments": {
        "file_path": "/workspace/envoy--v1.31.2/source/server/hot_restart_nop_impl.h"
      },
      "target_files": [
        "envoy--v1.31.2/source/server/hot_restart_nop_impl.h"
      ],
      "target_symbols": [],
      "hits_ground_truth": false,
      "matched_ground_truth_files": [],
      "is_subagent": false,
      "cumulative_tokens": 75104,
      "elapsed_seconds": 28.2
    },
    {
      "step_index": 20,
      "timestamp": "2026-03-01T19:03:32.467Z",
      "tool_name": "Read",
      "tool_category": "file_read",
      "is_mcp": false,
      "arguments": {
        "file_path": "/workspace/envoy--v1.31.2/source/common/api/posix/os_sys_calls_impl_hot_restart.h"
      },
      "target_files": [
        "envoy--v1.31.2/source/common/api/posix/os_sys_calls_impl_hot_restart.h"
      ],
      "target_symbols": [],
      "hits_ground_truth": false,
      "matched_ground_truth_files": [],
      "is_subagent": false,
      "cumulative_tokens": 86914,
      "elapsed_seconds": 31.8
    },
    {
      "step_index": 21,
      "timestamp": "2026-03-01T19:03:32.537Z",
      "tool_name": "Read",
      "tool_category": "file_read",
      "is_mcp": false,
      "arguments": {
        "file_path": "/workspace/envoy--v1.31.2/source/common/api/posix/os_sys_calls_impl_hot_restart.cc"
      },
      "target_files": [
        "envoy--v1.31.2/source/common/api/posix/os_sys_calls_impl_hot_restart.cc"
      ],
      "target_symbols": [],
      "hits_ground_truth": false,
      "matched_ground_truth_files": [],
      "is_subagent": false,
      "cumulative_tokens": 87116,
      "elapsed_seconds": 31.8
    },
    {
      "step_index": 23,
      "timestamp": "2026-03-01T19:03:37.466Z",
      "tool_name": "Read",
      "tool_category": "file_read",
      "is_mcp": false,
      "arguments": {
        "file_path": "/workspace/envoy--v1.31.2/source/server/hot_restarting_child.cc"
      },
      "target_files": [
        "envoy--v1.31.2/source/server/hot_restarting_child.cc"
      ],
      "target_symbols": [],
      "hits_ground_truth": false,
      "matched_ground_truth_files": [],
      "is_subagent": false,
      "cumulative_tokens": 91164,
      "elapsed_seconds": 36.8
    },
    {
      "step_index": 24,
      "timestamp": "2026-03-01T19:03:37.728Z",
      "tool_name": "Read",
      "tool_category": "file_read",
      "is_mcp": false,
      "arguments": {
        "file_path": "/workspace/envoy--v1.31.2/source/server/hot_restarting_parent.cc"
      },
      "target_files": [
        "envoy--v1.31.2/source/server/hot_restarting_parent.cc"
      ],
      "target_symbols": [],
      "hits_ground_truth": false,
      "matched_ground_truth_files": [],
      "is_subagent": false,
      "cumulative_tokens": 91409,
      "elapsed_seconds": 37.0
    },
    {
      "step_index": 25,
      "timestamp": "2026-03-01T19:04:05.010Z",
      "tool_name": "Write",
      "tool_category": "file_write",
      "is_mcp": false,
      "arguments": {
        "file_path": "/workspace/answer.json"
      },
      "target_files": [
        "answer.json"
      ],
      "target_symbols": [],
      "hits_ground_truth": false,
      "matched_ground_truth_files": [],
      "is_subagent": false,
      "cumulative_tokens": 96029,
      "elapsed_seconds": 64.3
    }
  ],
  "summary": {
    "total_events": 15,
    "mcp_events": 0,
    "local_events": 15,
    "unique_files_accessed": 15,
    "ground_truth_files_hit": 0,
    "ground_truth_files_total": 0,
    "first_ground_truth_hit_step": null,
    "events_by_category": {
      "file_read": 14,
      "file_write": 1
    }
  }
}
