{
  "schema_version": "1.0",
  "generated_at": "2026-03-03T00:30:21.733923+00:00",
  "provenance": {
    "run_id": "csb_sdlc_understand_haiku_022426",
    "batch_timestamp": "",
    "task_name": "terraform-plan-pipeline-qa-001",
    "trial_name": "terraform-plan-pipeline-qa-001__eUD6nwQ",
    "config_name": "baseline",
    "benchmark": "unknown",
    "model": "claude-haiku-4-5-20251001"
  },
  "coverage": {
    "has_trajectory": true,
    "has_transcript": true,
    "has_ground_truth": true,
    "has_chunk_ground_truth": false,
    "trace_source": "transcript",
    "degraded_reason": null,
    "ground_truth_source": "ground_truth_json_refs",
    "ground_truth_confidence": "medium"
  },
  "ground_truth": {
    "files": [
      "internal/terraform/graph_builder_plan.go",
      "internal/terraform/context_plan.go|internal/terraform/context.go",
      "internal/terraform/node_resource_plan.*.go",
      "internal/providers/provider.go|providers/provider.go",
      "transform_reference.go|internal/command/plan.go|command/plan.go",
      "eval_context.go|internal/terraform/graph.go|graph_walk"
    ]
  },
  "events": [
    {
      "step_index": 2,
      "timestamp": null,
      "tool_name": "Glob",
      "tool_category": "file_search",
      "is_mcp": false,
      "arguments": {
        "pattern": "**/internal/command/plan.go"
      },
      "target_files": [
        "internal/command/plan.go"
      ],
      "target_symbols": [],
      "hits_ground_truth": false,
      "matched_ground_truth_files": [],
      "is_subagent": false,
      "cumulative_tokens": null,
      "elapsed_seconds": null
    },
    {
      "step_index": 3,
      "timestamp": null,
      "tool_name": "Glob",
      "tool_category": "file_search",
      "is_mcp": false,
      "arguments": {
        "pattern": "**/plan*.go"
      },
      "target_files": [
        "internal/command/arguments/plan_test.go",
        "internal/command/arguments/plan.go",
        "internal/command/jsonformat/plan.go",
        "internal/command/jsonformat/plan_test.go",
        "internal/command/jsonplan/plan_test.go",
        "internal/command/jsonplan/plan.go",
        "internal/command/plan.go",
        "internal/command/plan_test.go",
        "internal/command/views/plan_test.go",
        "internal/command/views/plan.go",
        "internal/plans/planfile/planfile_test.go",
        "internal/plans/plan_test.go",
        "internal/plans/objchange/plan_valid.go",
        "internal/plans/objchange/plan_valid_test.go",
        "internal/plans/plan.go",
        "internal/plans/planproto/planfile.pb.go",
        "internal/stacks/stackplan/planned_change.go",
        "internal/stacks/stackplan/planned_change_test.go",
        "internal/stacks/stackplan/plan.go",
        "internal/stacks/stackruntime/internal/stackeval/planning.go",
        "internal/stacks/stackruntime/internal/stackeval/planning_test.go",
        "internal/stacks/stackruntime/plan.go",
        "internal/stacks/stackruntime/plan_test.go",
        "internal/states/statemgr/plan.go"
      ],
      "target_symbols": [],
      "hits_ground_truth": false,
      "matched_ground_truth_files": [],
      "is_subagent": false,
      "cumulative_tokens": null,
      "elapsed_seconds": null
    },
    {
      "step_index": 4,
      "timestamp": null,
      "tool_name": "Grep",
      "tool_category": "code_search",
      "is_mcp": false,
      "arguments": {
        "pattern": "type PlanOpts struct",
        "type": "go"
      },
      "target_files": [
        "internal/terraform/context_plan.go",
        "internal/stacks/stackruntime/internal/stackeval/planning.go"
      ],
      "target_symbols": [],
      "hits_ground_truth": false,
      "matched_ground_truth_files": [],
      "is_subagent": false,
      "cumulative_tokens": null,
      "elapsed_seconds": null
    }
  ],
  "summary": {
    "total_events": 3,
    "mcp_events": 0,
    "local_events": 3,
    "unique_files_accessed": 25,
    "ground_truth_files_hit": 0,
    "ground_truth_files_total": 6,
    "first_ground_truth_hit_step": null,
    "events_by_category": {
      "file_search": 2,
      "code_search": 1
    }
  }
}
